{
  "$schema": "https://json-schema.org/draft/2020-12/schema",
  "$id": "https://promptsyntax.org/conformance/adversarial-benchmark/0.1-draft",
  "title": "PromptSyntax Trace adversarial mutation benchmark",
  "type": "object",
  "additionalProperties": false,
  "required": [
    "format_version",
    "id",
    "version",
    "status",
    "suite",
    "profile",
    "evidence_unit",
    "selection_rule",
    "scoring",
    "scope",
    "threat_classes",
    "mutations"
  ],
  "properties": {
    "format_version": { "const": "0.1-draft" },
    "id": { "const": "trace-adversarial" },
    "version": { "type": "string", "minLength": 1 },
    "status": { "enum": ["candidate", "released"] },
    "suite": {
      "type": "object",
      "additionalProperties": false,
      "required": ["id", "version"],
      "properties": {
        "id": { "const": "promptsyntax-conformance" },
        "version": { "type": "string", "minLength": 1 }
      }
    },
    "profile": { "type": "string", "minLength": 1 },
    "evidence_unit": { "const": "paired-semantic-mutation" },
    "selection_rule": { "const": "all-negative-cases-with-trace-diagnostics" },
    "scoring": {
      "type": "object",
      "additionalProperties": false,
      "required": ["control_acceptance", "mutation_detection", "aggregation"],
      "properties": {
        "control_acceptance": { "const": "baseline-must-pass-as-conformant" },
        "mutation_detection": {
          "const": "mutant-must-fail-with-exact-diagnostic-set"
        },
        "aggregation": { "const": "unweighted-case-count" }
      }
    },
    "scope": {
      "type": "object",
      "additionalProperties": false,
      "required": ["claim", "attacker_capabilities", "excluded"],
      "properties": {
        "claim": { "type": "string", "minLength": 1 },
        "attacker_capabilities": {
          "type": "array",
          "minItems": 1,
          "uniqueItems": true,
          "items": { "type": "string", "minLength": 1 }
        },
        "excluded": {
          "type": "array",
          "minItems": 1,
          "uniqueItems": true,
          "items": { "type": "string", "minLength": 1 }
        }
      }
    },
    "threat_classes": {
      "type": "array",
      "minItems": 1,
      "items": {
        "type": "object",
        "additionalProperties": false,
        "required": ["id", "description"],
        "properties": {
          "id": { "$ref": "#/$defs/kebab_id" },
          "description": { "type": "string", "minLength": 1 }
        }
      }
    },
    "mutations": {
      "type": "array",
      "minItems": 1,
      "items": {
        "type": "object",
        "additionalProperties": false,
        "required": [
          "id",
          "threat_class",
          "operator",
          "baseline_case",
          "mutant_case",
          "controlled_paths",
          "attack",
          "intended_diagnostics"
        ],
        "properties": {
          "id": { "type": "string", "pattern": "^A[0-9]{3}$" },
          "threat_class": { "$ref": "#/$defs/kebab_id" },
          "operator": {
            "enum": [
              "content-corruption",
              "cross-source-divergence",
              "duplication",
              "field-omission",
              "field-replacement",
              "metadata-corruption",
              "policy-conflict"
            ]
          },
          "baseline_case": { "$ref": "#/$defs/kebab_id" },
          "mutant_case": { "$ref": "#/$defs/kebab_id" },
          "controlled_paths": {
            "type": "array",
            "minItems": 1,
            "uniqueItems": true,
            "items": {
              "type": "string",
              "pattern": "^/(trace|transcript)(/([^/~]|~0|~1)+)+$"
            }
          },
          "attack": { "type": "string", "minLength": 1 },
          "intended_diagnostics": { "$ref": "#/$defs/diagnostic_set" }
        }
      }
    }
  },
  "$defs": {
    "kebab_id": {
      "type": "string",
      "pattern": "^[a-z0-9][a-z0-9-]*$"
    },
    "diagnostic_set": {
      "type": "array",
      "minItems": 1,
      "uniqueItems": true,
      "items": { "type": "string", "pattern": "^[A-Z][A-Z0-9_]+$" }
    }
  }
}
